grupo,subgrupo,renglon,concepto,activo
0,1,011,Personal permanente,true
0,1,012,Complemento personal al salario del personal permanente,true
0,1,013,Complemento por antigüedad al personal permanente,true
0,1,014,Complemento por calidad profesional al personal permanente,true
0,1,015,Complementos específicos al personal permanente,true
0,1,016,Complemento por transporte al personal permanente,true
0,1,017,Derechos escalafonarios,true
0,1,018,Complemento por diferencial cambiario al personal en el exterior,true
0,2,021,Personal supernumerario,true
0,2,022,Personal por contrato,true
0,2,023,Interinatos por licencias y becas,true
0,2,024,Complemento personal al salario del personal temporal,true
0,2,025,Complemento por antigüedad al personal temporal,true
0,2,026,Complemento por calidad profesional al personal temporal,true
0,2,027,Complementos específicos al personal temporal,true
0,2,028,Complemento por transporte al personal temporal,true
0,2,029,Otras remuneraciones de personal temporal,true
0,3,031,Jornales,true
0,3,032,Complemento por antigüedad al personal por jornal,true
0,3,033,Complementos específicos al personal por jornal,true
0,3,034,Complemento por transporte al personal por jornal,true
0,3,035,Retribuciones a destajo,true
0,3,036,Retribuciones por servicios,true
0,3,037,Retribuciones a juntas examinadoras,true
0,4,041,Servicios extraordinarios de personal permanente,true
0,4,042,Servicios extraordinarios de personal temporal,true
0,4,043,Servicios extraordinarios de personal por jornal,true
0,4,044,Servicios extraordinarios por turnos a médicos de guardia,true
0,5,051,Aporte patronal al IGSS,true
0,5,052,Aporte patronal al Intecap,true
0,5,053,Cuota por seguros sociales por personal en el exterior,true
0,5,054,Cuota recreacional,true
0,5,055,Aporte para clases pasivas,true
0,6,061,Dietas,true
0,6,062,Dietas para cargos representativos,true
0,6,063,Gastos de representación en el interior,true
0,6,064,Gastos de representación en el exterior,true
0,7,071,Aguinaldo,true
0,7,072,Bonificación anual (Bono 14),true
0,7,073,Bono vacacional,true
0,7,074,Compensación costo de vida por servicios en el exterior,true
0,7,079,Otras prestaciones,true
0,8,081,"Personal administrativo, técnico, profesional y operativo",true
1,11,111,Energía eléctrica,true
1,11,112,Agua,true
1,11,113,Telefonía,true
1,11,114,Correos y telégrafos,true
1,11,115,Extracción de basura y destrucción de desechos sólidos,true
1,11,116,Servicios de lavandería,true
1,12,121,Divulgación e información,true
1,12,122,"Impresión, encuadernación y reproducción",true
1,12,123,Divulgación de información de organizaciones políticas,true
1,13,131,Viáticos en el exterior,true
1,13,132,Viáticos de representación en el exterior,true
1,13,133,Viáticos en el interior,true
1,13,134,Compensación por kilómetro recorrido,true
1,13,135,Otros viáticos y gastos conexos,true
1,13,136,Reconocimiento de gastos,true
1,14,141,Transporte de personas,true
1,14,142,Fletes,true
1,14,143,Almacenaje,true
1,15,151,Arrendamiento de edificios y locales,true
1,15,152,Arrendamiento de tierras y terrenos,true
1,15,153,Arrendamiento de máquinas y equipos de oficina,true
1,15,154,Arrendamiento de maquinaria y equipo de construcción,true
1,15,155,Arrendamiento de medios de transporte,true
1,15,156,Arrendamiento de otras máquinas y equipo,true
1,15,157,Arrendamiento de equipo de cómputo,true
1,15,158,Derechos de bienes intangibles,true
1,16,161,Mantenimiento y reparación de maquinaria y equipo de producción,true
1,16,162,Mantenimiento y reparación de equipo de oficina,true
1,16,163,"Mantenimiento y reparación de equipo médico, sanitario y de laboratorio",true
1,16,164,Mantenimiento y reparación de equipos educacionales y recreativos,true
1,16,165,Mantenimiento y reparación de medios de transporte,true
1,16,166,Mantenimiento y reparación de equipo para comunicaciones,true
1,16,167,Mantenimiento y reparación de maquinaria y equipo de construcción,true
1,16,168,Mantenimiento y reparación de equipo de cómputo,true
1,16,169,Mantenimiento y reparación de otras maquinarias y equipos,true
1,17,171,Mantenimiento y reparación de edificios,true
1,17,172,Mantenimiento y reparación de viviendas,true
1,17,173,Mantenimiento y reparación de bienes nacionales de uso común,true
1,17,174,Mantenimiento y reparación de instalaciones,true
1,17,175,Mantenimiento y reparación de construcciones militares,true
1,17,176,Mantenimiento y reparación de otras obras e instalaciones,true
1,18,181,"Estudios, investigaciones y proyectos de pre-factibilidad y factibilidad",true
1,18,182,Servicios médico-sanitarios,true
1,18,183,Servicios jurídicos,true
1,18,184,"Servicios económicos, financieros, contables y de auditoría",true
1,18,185,Servicios de capacitación,true
1,18,186,Servicios de informática y sistemas computarizados,true
1,18,187,Servicios por actuaciones artísticas y deportivas,true
1,18,188,"Servicios de ingeniería, arquitectura y supervisión de obras",true
1,18,189,Otros estudios y/o servicios,true
1,19,191,Primas y gastos de seguros y fianzas,true
1,19,192,Comisiones a receptores fiscales y recaudadores,true
1,19,193,Comisiones a colocadores de pólizas,true
1,19,194,"Gastos bancarios, comisiones y otros gastos",true
1,19,195,"Impuestos, derechos y tasas",true
1,19,196,Servicios de atención y protocolo,true
1,19,197,Servicios de vigilancia,true
1,19,198,Recompensas para seguridad del Estado,true
1,19,199,Otros servicios,true
2,21,211,Alimentos para personas,true
2,21,212,"Granos, forrajes, concentrados y alimentos destinados a consumo para animales",true
2,21,213,Productos animales,true
2,21,214,"Productos agroforestales, madera, corcho y sus manufacturas",true
2,21,215,Productos agropecuarios para comercialización,true
2,21,219,"Otros alimentos, productos agroforestales y agropecuarios",true
2,22,221,Carbón mineral,true
2,22,222,Minerales metálicos,true
2,22,223,"Piedra, arcilla y arena",true
2,22,224,"Pómez, cal y yeso",true
2,22,225,Minerales no metálicos,true
2,22,229,Otros minerales,true
2,23,231,Hilados y telas,true
2,23,232,Acabados textiles,true
2,23,233,Prendas de vestir,true
2,23,239,Otros textiles y vestuario,true
2,24,241,Papel de escritorio,true
2,24,242,"Papeles comerciales, cartulinas, cartones y otros",true
2,24,243,Productos de papel o cartón,true
2,24,244,Productos de artes gráficas,true
2,24,245,"Libros, revistas y periódicos",true
2,24,246,Textos de enseñanza,true
2,24,247,Especies timbradas y valores,true
2,24,249,"Otros productos de papel, cartón e impresos",true
2,25,251,Cueros y pieles,true
2,25,252,Artículos de cuero,true
2,25,253,Llantas y neumáticos,true
2,25,254,Artículos de caucho,true
2,26,261,Elementos y compuestos químicos,true
2,26,262,Combustibles y lubricantes,true
2,26,263,Abonos y fertilizantes,true
2,26,264,"Insecticidas, fumigantes y similares",true
2,26,265,Asfalto y similares,true
2,26,266,Productos medicinales y farmacéuticos,true
2,26,267,"Tintes, pinturas y colorantes",true
2,26,268,"Productos plásticos, nylon, vinil y P.V.C.",true
2,26,269,Otros productos químicos y conexos,true
2,27,271,Productos de arcilla,true
2,27,272,Productos de vidrio,true
2,27,273,Productos de loza y porcelana,true
2,27,274,Cemento,true
2,27,275,"Productos de cemento, pómez, asbesto y yeso",true
2,27,279,Otros productos de minerales no metálicos,true
2,28,281,Productos siderúrgicos,true
2,28,282,Productos metalúrgicos no férricos,true
2,28,283,Productos de metal y sus aleaciones,true
2,28,284,Estructuras metálicas acabadas,true
2,28,285,Materiales y equipos diversos,true
2,28,286,Herramientas menores,true
2,28,289,Otros productos metálicos,true
2,29,291,Útiles de oficina,true
2,29,292,"Productos sanitarios, de limpieza y de uso personal",true
2,29,293,Útiles educacionales y culturales,true
2,29,294,Útiles deportivos y recreativos,true
2,29,295,"Útiles menores, suministros e instrumental médicoquirúrgicos, de laboratorio y cuidado de la salud",true
2,29,296,Útiles de cocina y comedor,true
2,29,297,"Materiales, productos y accesorios eléctricos, cableado estructurado de redes informáticas y telefónicas",true
2,29,298,Accesorios y repuestos en general,true
2,29,299,Otros materiales y suministros,true
3,31,311,Tierras y terrenos,true
3,31,312,"Edificios, estructuras e instalaciones",true
3,31,313,Otros bienes muebles preexistentes,true
3,31,314,Edificios e instalaciones militares,true
3,31,315,Adquisición de bienes de uso común,true
3,32,321,Maquinaria y equipo de producción,true
3,32,322,Mobiliario y equipo de oficina,true
3,32,323,Mobiliario y equipo médico-sanitario y de laboratorio,true
3,32,324,"Equipo educacional, cultural y recreativo",true
3,32,325,Equipo de transporte,true
3,32,326,Equipo para comunicaciones,true
3,32,327,Maquinaria y equipo para la construcción,true
3,32,328,Equipo de cómputo,true
3,32,329,Otras maquinarias y equipos,true
3,33,331,Construcciones de bienes nacionales de uso común,true
3,33,332,Construcciones de bienes nacionales de uso no común,true
3,33,333,Construcciones militares,true
3,34,341,Equipo militar y de seguridad,true
3,35,351,"Libros, revistas y otros elementos coleccionables",true
3,36,361,Obras de arte,true
3,37,371,Animales,true
3,38,381,Activos intangibles,true
4,41,411,Ayuda para funerales,true
4,41,412,Prestaciones póstumas,true
4,41,413,Indemnizaciones al personal,true
4,41,414,Indemnizaciones por pérdida de valores,true
4,41,415,Vacaciones pagadas por retiro,true
4,41,416,Becas de estudio en el interior,true
4,41,417,Becas de estudio en el exterior,true
4,41,419,Otras transferencias a personas individuales,true
4,42,421,Pensiones,true
4,42,422,Jubilaciones y/o retiros,true
4,42,423,Prestaciones por incapacidad temporal,true
4,42,424,Prestaciones globales por incapacidad permanente,true
4,42,425,Prestaciones especiales de rehabilitación,true
4,42,426,Gastos de entierro,true
4,42,427,Pensiones a sobrevivientes,true
4,42,428,"Prestaciones por invalidez, vejez y sobrevivencia",true
4,42,429,Otras prestaciones y pensiones,true
4,43,431,Transferencias a instituciones de enseñanza,true
4,43,432,Transferencias a instituciones de salud y asistencia social,true
4,43,433,Transferencias a instituciones científicas y tecnológicas,true
4,43,434,Transferencias a entidades religiosas,true
4,43,435,Transferencias a otras instituciones sin fines de lucro,true
4,43,436,Transferencias a cooperativas,true
4,43,437,Transferencias a empresas privadas,true
4,44,441,Transferencias al Organismo Judicial,true
4,44,442,Transferencias a la Corte de Constitucionalidad,true
4,44,443,Transferencias a la Universidad de San Carlos de Guatemala,true
4,44,444,Transferencias a municipalidades,true
4,44,445,Transferencias al deporte,true
4,44,446,Transferencias para alfabetización,true
4,44,447,Aportes del Estado a la Contraloría General de Cuentas.,true
4,44,448,Otras transferencias a municipalidades,true
4,45,451,Transferencias a la Administración Central,true
4,45,452,Transferencias al Instituto Guatemalteco de Seguridad Social (IGSS),true
4,45,453,Transferencias a entidades descentralizadas y autónomas no financieras,true
4,45,454,Transferencias a instituciones públicas financieras,true
4,45,455,Cuota sostenimiento Superintendencia de Bancos,true
4,45,456,Servicios Gubernamentales de Fiscalización,true
4,46,461,Transferencias a empresas públicas no financieras,true
4,47,471,Transferencias a gobiernos extranjeros,true
4,47,472,Transferencias a organismos e instituciones internacionales,true
4,47,473,Transferencias a organismos regionales,true
4,48,481,Transferencias a entidades públicas municipales no empresariales,true
4,48,482,Transferencias a entidades públicas municipales de seguridad social,true
4,48,483,Transferencias a mancomunidades,true
4,48,484,Transferencias a empresas públicas municipales no financieras,true
4,48,485,Transferencias a empresas públicas municipales financieras,true
5,51,511,Transferencias a personas individuales y unidades familiares,true
5,51,512,Transferencias a instituciones sin fines de lucro,true
5,51,513,Transferencias a cooperativas,true
5,51,514,Transferencias a empresas privadas,true
5,52,521,Transferencias al Organismo Judicial,true
5,52,522,Transferencias a la Universidad de San Carlos de Guatemala,true
5,52,523,Transferencias a las municipalidades,true
5,52,524,Transferencias al deporte,true
5,53,531,Transferencias a la Administración Central,true
5,53,532,Transferencias a los Consejos de Desarrollo Urbano y Rural,true
5,53,533,Transferencias a entidades descentralizadas y autónomas no financieras,true
5,53,534,Transferencias a instituciones públicas financieras,true
5,53,536,Otras transferencias a municipalidades,true
5,54,541,Transferencias a empresas públicas no financieras,true
5,55,551,Transferencias a gobiernos extranjeros,true
5,55,552,Transferencias a organismos e instituciones internacionales,true
5,55,553,Transferencias a organismos regionales,true
5,56,561,Transferencias a entidades públicas municipales no empresariales,true
5,56,562,Transferencias a entidades públicas municipales de seguridad social,true
5,56,563,Transferencias a mancomunidades,true
5,56,564,Transferencias a empresas públicas municipales no financieras,true
5,56,565,Transferencias a empresas públicas municipales financieras,true
6,61,611,Títulos y valores a corto plazo,true
6,61,612,Títulos y valores a largo plazo,true
6,62,621,Compra de acciones y/o participaciones a empresas privadas nacionales,true
6,62,622,Compra de acciones y/o participaciones a empresas públicas no financieras,true
6,62,623,Compra de acciones y/o participaciones a instituciones públicas financieras,true
6,62,624,Compra de acciones y/o participaciones a organismos internacionales,true
6,62,625,Compra de acciones y/o participaciones al resto del sector externo,true
6,63,631,Préstamos al sector privado,true
6,63,632,Préstamos a la Administración Central,true
6,63,633,Préstamos a las entidades descentralizadas y autónomas no financieras,true
6,63,634,Préstamos a instituciones públicas financieras,true
6,63,635,Préstamos a empresas públicas nacionales,true
6,63,636,Préstamos a empresas municipales,true
6,63,637,Préstamos a municipalidades,true
6,63,638,Préstamos a gobiernos extranjeros y organizaciones del sector externo,true
6,64,641,Préstamos al sector privado,true
6,64,642,Préstamos a la Administración Central,true
6,64,643,Préstamos a las entidades descentralizadas y autónomas no financieras,true
6,64,644,Préstamos a instituciones públicas financieras,true
6,64,645,Préstamos a empresas públicas nacionales,true
6,64,646,Préstamos a empresas municipales,true
6,64,647,Préstamos a municipalidades,true
6,64,648,Préstamos a gobiernos extranjeros y organizaciones del sector externo,true
6,65,651,Incremento de caja y bancos,true
6,65,652,Incremento de inversiones financieras temporales,true
6,66,661,Incremento de cuentas comerciales a cobrar a corto plazo,true
6,66,662,Incremento de otras cuentas a cobrar a corto plazo,true
6,66,663,Incremento de cuentas comerciales a cobrar a largo plazo,true
6,66,664,Incremento de otras cuentas a cobrar a largo plazo,true
6,67,671,Incremento de documentos comerciales a cobrar a corto plazo,true
6,67,672,Incremento de otros documentos a cobrar a corto plazo,true
6,67,673,Incremento de documentos comerciales a cobrar a largo plazo,true
6,67,674,Incremento de otros documentos a cobrar a largo plazo,true
6,68,681,Incremento de activos diferidos a corto plazo,true
6,68,682,Anticipos a contratistas y proveedores a corto plazo,true
6,68,683,Incremento de activos diferidos a largo plazo,true
6,68,684,Anticipos a contratistas y proveedores a largo plazo,true
6,69,685,Incremento de fideicomisos,true
6,69,691,Fondos otorgados a instituciones públicas financieras,true
7,71,711,Intereses de la deuda interna a corto plazo,true
7,71,712,Comisiones y otros gastos de la deuda interna a corto plazo,true
7,71,713,Amortización de la deuda interna a corto plazo,true
7,71,714,Intereses de la deuda interna a largo plazo,true
7,71,715,Comisiones y otros gastos de la deuda interna a largo plazo,true
7,71,716,Amortización de la deuda interna a largo plazo,true
7,71,717,Descuentos de deuda interna a largo plazo,true
7,71,718,Amortización de primas de la deuda interna a largo plazo,true
7,71,719,Amortización deficiencias netas del Banco de Guatemala,true
7,72,721,Intereses de la deuda externa a corto plazo,true
7,72,722,Comisiones y otros gastos de la deuda externa a corto plazo,true
7,72,723,Amortización de la deuda externa a corto plazo,true
7,72,724,Intereses de la deuda externa a largo plazo,true
7,72,725,Comisiones y otros gastos de la deuda externa a largo plazo,true
7,72,726,Amortización de la deuda externa a largo plazo,true
7,72,727,Descuentos de deuda externa a largo plazo,true
7,72,728,Amortización de primas de la deuda externa a largo plazo,true
7,73,731,Intereses por préstamos del sector privado,true
7,73,732,Intereses por préstamos del sector público no financiero,true
7,73,733,Intereses por préstamos del sector público financiero,true
7,73,734,Intereses por préstamos del sector externo,true
7,73,735,Comisiones y gastos por préstamos del sector privado,true
7,73,736,Comisiones y gastos por préstamos del sector público no financiero,true
7,73,737,Comisiones y gastos por préstamos del sector público financiero,true
7,73,738,Comisiones y gastos por préstamos del sector externo,true
7,74,741,Amortización de préstamos del sector privado,true
7,74,742,Amortización de préstamos de la Administración Central,true
7,74,743,Amortización de préstamos de entidades descentralizadas y autónomas no financieras,true
7,74,744,Amortización de préstamos de instituciones públicas financieras,true
7,74,745,Amortización de préstamos de empresas públicas no financieras,true
7,74,746,Amortización de préstamos de municipalidades,true
7,74,747,Amortización de préstamos de gobiernos extranjeros,true
7,74,748,Amortización de préstamos de organismos e instituciones regionales e internacionales,true
7,75,751,Amortización de préstamos del sector privado,true
7,75,752,Amortización de préstamos de la Administración Central,true
7,75,753,Amortización de préstamos de entidades descentralizadas y autónomas no financieras,true
7,75,754,Amortización de préstamos de instituciones públicas,true
7,75,755,financieras Amortización de préstamos de empresas públicas no financieras,true
7,75,756,Amortización de préstamos de municipalidades,true
7,75,757,Amortización de préstamos de gobiernos extranjeros,true
7,75,758,Amortización de préstamos de organismos e instituciones regionales e internacionales,true
7,76,761,Disminución de cuentas comerciales a pagar a corto plazo,true
7,76,762,Disminución de cuentas a pagar a corto plazo con contratistas,true
7,76,763,Disminución de gastos de personal a pagar a corto plazo,true
7,76,764,"Disminución de cuentas a pagar por impuestos, tasas y derechos a corto plazo",true
7,76,765,Disminución de cuentas a pagar por intereses a corto plazo,true
7,76,766,Disminución de otras cuentas a pagar a corto plazo,true
7,76,767,Disminución de cuentas comerciales a pagar a largo plazo,true
7,76,769,Disminución de otras cuentas a pagar a largo plazo,true
7,77,771,Disminución de depósitos a la vista,true
7,77,772,Disminución de depósitos en cuentas de ahorros y plazo fijo,true
7,78,781,Disminución de documentos comerciales a pagar a corto plazo,true
7,78,782,Disminución de otros documentos a pagar a corto plazo,true
7,78,783,Disminución de documentos comerciales a pagar de largo plazo,true
7,78,784,Disminución de otros documentos a pagar de largo plazo,true
7,78,785,"Conversión de la deuda interna a largo plazo, en a corto plazo",true
7,78,786,"Conversión de la deuda interna a corto plazo, en a largo plazo",true
7,78,787,"Conversión de la deuda externa a largo plazo, en a",true
7,78,788,"corto plazo Conversión de la deuda externa a corto plazo, en a largo plazo",true
7,79,791,Disminución de pasivos diferidos a corto plazo,true
7,79,792,Disminución de pasivos diferidos a largo plazo,true
7,79,793,Disminución de provisiones para cuentas incobrables,true
7,79,794,Disminución de provisiones para pérdidas de inventarios,true
7,79,795,Disminución de provisiones para beneficios sociales,true
7,79,796,Disminución de otras provisiones y reservas técnicas,true
7,79,799,Disminución de otros pasivos a corto plazo,true
8,81,811,Impuestos directos,true
8,82,821,Descuentos por ventas,true
8,82,822,Bonificaciones por ventas,true
8,82,823,Devoluciones,true
8,83,831,Depreciación del activo fijo,true
8,83,832,Amortización del activo intangible,true
8,84,841,Beneficios sociales,true
8,85,851,Reservas legales,true
8,85,852,Reservas de capitalización,true
8,85,859,Otras reservas técnicas,true
8,86,861,Cuentas incobrables,true
8,86,862,Pérdidas de inventarios,true
8,86,863,Pérdidas por venta de activos,true
8,86,864,Pérdidas por operaciones cambiarias en intereses,true
8,86,865,Pérdidas por operaciones cambiarias en amortización,true
8,86,866,Otras pérdidas de operaciones,true
8,86,867,Otras pérdidas ajenas a la operación,true
8,86,868,Pérdidas en la colocación de valores públicos,true
8,87,871,Disminución del capital social e institucional,true
8,87,872,Disminución de aportes por capitalizar,true
8,87,873,Disminución de reservas,true
8,87,874,Disminución de resultados por dividendos a distribuir,true
8,87,875,Disminución de resultados por utilidades a transferir a la Administración Central,true
8,87,876,Disminución de resultados por utilidades a transferir a empleados,true
8,87,877,Disminución de resultados acumulados,true
8,87,878,Disminución de resultados por utilidades a transferir a municipalidades,true
8,87,879,Disminución de resultados por utilidades a transferir a otras entidades descentralizadas y autónomas,true
8,88,881,Intereses de instituciones públicas financieras bancarias,true
8,88,882,Intereses de instituciones públicas no financieras no bancarias,true
8,89,891,Reclamos por seguros de hipotecas,true
8,89,892,Reclamos por seguros de desgravamen,true
9,91,911,Emergencias y calamidades públicas,true
9,91,912,Siniestros y gastos conexos,true
9,91,913,Sentencias judiciales,true
9,91,914,Gastos no previstos,true
9,99,991,Créditos de reserva Manual de Clasificacio,true
